{
  "case_id": "qc-variant-comparison",
  "host": "claude-code",
  "lane_scores": {
    "activation_routing": 10,
    "production_usability": 24,
    "task_completeness": 35,
    "evidence_discipline": 20,
    "language_scope": 10
  },
  "total": 99,
  "verdict": "PASS",
  "critical_failures": [],
  "activation_verified": true,
  "evidence": [
    "final.md:3-5 establishes user-reported symptoms as the only modality and explicitly denies direct clip/frame observation.",
    "final.md:9-16 selects Variant A, applies hard gates before aesthetics and fails B for open case, wrong hand and green-door endpoint despite its camera polish.",
    "final.md:23-65 compares hard gates and classifies every A/B statement as reported, inference or unknown, including all unreported B identity/count/direction and both audio dimensions.",
    "final.md:67-76 keeps camera/state/reflection causes as ranked hypotheses rather than facts.",
    "final.md:78-97 preserves A as the checkpoint, repairs only the four-frame reflection locally, treats slower push as a tolerance/post candidate and permits at most one isolated endpoint-camera regeneration while fixing all state invariants.",
    "final.md:99-117 supplies finite oscillation/repeated-defect stops and exact full-media/runtime evidence still needed for final approval or diagnosis.",
    "native-evidence.md:7-21 records implicit native discovery/activation and complete three-skill listing; run.json:8-91 attests claude-fable-5/max, no fallback, exit_code 0, research absent and no paid media events."
  ],
  "rationale": "The decision is exactly production-rational: correct state/end hard gates beat beauty, A's local defects stay local, and no direct inspection is invented. Every required A/B observation, hypothesis, repair route and missing-evidence boundary is present. The one-point deduction is for unnecessary host/plan commentary and excess length, not a behavioral omission or critical failure.",
  "activation_evidence": "Verified implicit native activation: native-evidence.md:7-21 records automatic seedance-video-qc events, all three skills listed and discovery_complete true; run.json:81-86 gives exact activation indices.",
  "unknowns": [
    "No native clips/frames were supplied, so all reported A/B states and defects remain uncorroborated by the evaluator session.",
    "Push-in specification/tolerance, fps, resolution headroom, prompts/references/runtime and audio remain unknown."
  ],
  "grader": {
    "role": "Independent Staff+ Adversarial Evaluator",
    "model": "gpt-5.6-sol",
    "effort": "ultra",
    "independent": true
  }
}
