{
  "case_id": "quality-speed-tradeoff",
  "host": "codex",
  "lane_scores": {
    "activation_routing": 10,
    "production_usability": 25,
    "task_completeness": 35,
    "evidence_discipline": 20,
    "language_scope": 10
  },
  "total": 100,
  "verdict": "PASS",
  "critical_failures": [],
  "activation_verified": true,
  "evidence": [
    "final.md:1-33 compares three distinct policies, marks every ceiling untested, and denies a controlled fastest/best winner.",
    "final.md:35-102 defines A/B/C allocation, dialogue/crash coverage, parallel/serial dependencies, and common rights/story/identity/dialogue/crash/edit/delivery hard floors.",
    "final.md:104-151 gives finite user-requested retry/route ceilings, VFX/editorial alternatives, approved-only lineage, and rollback; final.md:153-192 defines post ownership and actual-ledger KPIs without invented rates/costs.",
    "native-evidence.md:11-12 verifies Film Producer; run.json records no paid generation."
  ],
  "rationale": "Every requested workflow, floor, tier, dependency, ceiling, recovery route, post responsibility, KPI, and untested-policy boundary is operationally complete.",
  "activation_evidence": "native-evidence.md:11-12 verifies expected implicit activation.",
  "unknowns": [
    "Platform, team capacity, actual costs/rates, and festival delivery requirements remain correctly unknown."
  ],
  "grader": {
    "role": "Independent adversarial reviewer (provider: OpenAI)",
    "model": "gpt-5.6-sol",
    "effort": "high",
    "independent": true
  }
}
