{"case_id":"coarse-blockout-mapping","host":"claude-code","lane_scores":{"activation_routing":10,"production_usability":25,"task_completeness":35,"evidence_discipline":18,"language_scope":9},"total":97,"verdict":"PASS","critical_failures":[],"activation_verified":true,"evidence":["run.json: implicit routing activated seedance-prompt-director only; paid_media_tool_events is empty.","final.md maps the red blockout model to @Image 1 courier and blue model to @Image 2 guard without swapping identities.","final.md limits @Video 1 inheritance to paths, blocking, relative scale, camera, and cut rhythm; gray primitives, guide lines, axes, camera cone, viewport, and overlays are excluded.","final.md limits @Image 3 to stone-gate/market materials and sunset light, and ends with exactly one letter at table center while the guard remains behind the table."],"rationale":"The blockout is correctly treated as a structural blueprint rather than an edit master or render-style source. The prompt adds a few labeled assumptions such as hand choice/audio, but no named clay mode or runtime capability is claimed.","activation_evidence":"native-evidence.md records seedance-prompt-director activation at event[10] Skill, event[23] Read, and event[25] Read.","unknowns":["Actual blockout geometry and image contents were not available for inspection."],"grader":{"role":"fresh-context adversarial reviewer","model":"gpt-5.6-sol","effort":"high","independent":true}}
