{"case_id":"cross-shot-state-continuity","host":"claude-code","lane_scores":{"activation_routing":10,"production_usability":25,"task_completeness":35,"evidence_discipline":19,"language_scope":9},"total":98,"verdict":"PASS","critical_failures":[],"activation_verified":true,"evidence":["run.json: implicit routing activated only seedance-film-producer; paid_media_tool_events is empty.","final.md defines immutable dry, wet-shoulder, wet, fresh-injury, and dried-injury state assets plus sealed/pocketed/transferred/open envelope states.","final.md shot manifest gives per-shot start, delta, end, required, and forbidden states, including right-hand transfer and no opening before shot 5.","final.md locks screen direction, canonical/approved/local handoffs, stable IDs, parent-approved retry lineage, checkpoints, rollback, and no automatic promotion of the latest render."],"rationale":"This is a complete and internally coherent five-shot continuity system. Invented production choices such as Tomas receiving with his left hand are presented as plan decisions and do not contradict the brief.","activation_evidence":"native-evidence.md records seedance-film-producer activation at event[6] Skill, event[13] Read, event[15] Read, and event[44] Read.","unknowns":["Platform, shot durations, project retry ceiling, and actual approved reference assets are not supplied."],"grader":{"role":"fresh-context adversarial reviewer","model":"gpt-5.6-sol","effort":"high","independent":true}}
