{"case_id":"quality-speed-tradeoff","host":"claude-code","lane_scores":{"activation_routing":10,"production_usability":25,"task_completeness":35,"evidence_discipline":19,"language_scope":9},"total":98,"verdict":"PASS","critical_failures":[],"activation_verified":true,"evidence":["run.json: implicit seedance-film-producer activation is verified; paid_media_tool_events is empty.","final.md distinctly compares quality-max, speed-max-with-floor, and hybrid policies, and recommends hybrid without claiming controlled superiority.","final.md preserves common story/identity/state/rights/delivery floors and allocates hero dialogue/crash/low-risk shots to A/B/C tiers with parallel versus serial dependencies.","final.md supplies explicitly proposed finite retry/route ceilings, finishing responsibilities, and ledger-derived KPI definitions without inventing costs or success rates."],"rationale":"The answer meets every policy-comparison requirement and clearly separates proposed numeric ceilings from measured performance. It is production-ready for the stated ten-day planning horizon.","activation_evidence":"native-evidence.md records seedance-film-producer activation at event[6] Skill, event[14] Read, event[16] Read, event[18] Read, and event[20] Read.","unknowns":["Team size, budget, quota, runtime, delivery spec, and actual benchmark performance remain unknown and are correctly left as charter/ledger inputs."],"grader":{"role":"fresh-context adversarial reviewer","model":"gpt-5.6-sol","effort":"high","independent":true}}
