{"case_id":"accepted-deviation-beat-firewall","host":"claude-code","lane_scores":{"activation_routing":10,"production_usability":25,"task_completeness":35,"evidence_discipline":19,"language_scope":9},"total":98,"verdict":"PASS","critical_failures":[],"activation_verified":true,"evidence":["run.json: activated_skills contains only seedance-film-producer, with expected-skill evidence at event[7] Read and event[9] Read; paid_media_tool_events is empty.","final.md §1 marks opening and reading completed, removes beat 2 downstream, and makes folding the letter the sole current delta.","final.md §4 keeps the rejected torn-letter run out of canonical state, approved memory, and handoff sources.","final.md §3 selects seamless continuation only if the accepted tail passes QC, otherwise a known-state insert/new-shot bridge; retry ceilings remain project-defined or unknown."],"rationale":"The accepted deviation advances the beat firewall without duplicating completed work or canonizing the rejected tear. The continuation decision and downstream serialization are production-usable and bounded.","activation_evidence":"native-evidence.md records explicit invocation and activation of seedance-film-producer at event[7] Read and event[9] Read.","unknowns":["The actual accepted tail frame and asset-state QC were not supplied, so seamless versus insert remains conditional."],"grader":{"role":"fresh-context adversarial reviewer","model":"gpt-5.6-sol","effort":"high","independent":true}}
