{"case_id":"sequential-edit-then-extend","host":"claude-code","lane_scores":{"activation_routing":10,"production_usability":24,"task_completeness":34,"evidence_discipline":18,"language_scope":9},"total":95,"verdict":"PASS","critical_failures":[],"activation_verified":true,"evidence":["run.json: explicit seedance-prompt-director activation is verified; paid_media_tool_events is empty.","final.md delivers two separately submittable ordered artifacts: an @Video 1 blue-to-red umbrella edit and a later append.","Artifact 1 names @Video 1 as sole master and preserves people/actions/camera/background/light/grade/weather/audio; Artifact 2 names the verified Edited Video 1 as sole source and appends only new material.","Artifact 2 carries the same adult and red umbrella through lowering/closing and entering the doorway, with explicit boundary placeholders to fill from the approved edited tail."],"rationale":"The operation boundary and parent lineage are correct. The response unnecessarily mentions archived surface-specific task-hint/duration evidence and proposes a longer duration in a later failure route, but it does not combine operations or assert unverified current support.","activation_evidence":"native-evidence.md records seedance-prompt-director activation at event[11] Read and event[13] Read.","unknowns":["Actual source/edited tail, doorway geometry, runtime edit/extend support, and precise four-second behavior remain unverified."],"grader":{"role":"fresh-context adversarial reviewer","model":"gpt-5.6-sol","effort":"high","independent":true}}
