{"case_id":"continuation-observation-boundary","host":"claude-code","lane_scores":{"activation_routing":10,"production_usability":24,"task_completeness":34,"evidence_discipline":18,"language_scope":9},"total":95,"verdict":"PASS","critical_failures":[],"activation_verified":true,"evidence":["run.json: implicit seedance-prompt-director activation is verified and no paid media tool event occurred.","final.md labels every supplied boundary fact as low-confidence user report, explicitly not direct observation.","final.md separately marks subject motion, camera velocity, and sound phase unknown, and confines the generated material to after the source.","final.md labels the door-entry event as a replaceable assumption and does not assert a platform mode or metadata."],"rationale":"The response cleanly separates reported visible state from unknown temporal state and produces a usable provider-neutral continuation. The assumed door-entry/audio design is properly labeled but adds more speculative detail than the minimum required.","activation_evidence":"native-evidence.md records seedance-prompt-director activation at event[8] Skill, event[17] Read, event[19] Read, and event[35] Read.","unknowns":["Actual final-frame pose, motion, camera state, audio phase, door state, and continuation event remain unverified."],"grader":{"role":"fresh-context adversarial reviewer","model":"gpt-5.6-sol","effort":"high","independent":true}}
