{
  "case_id": "qc-variant-comparison",
  "host": "codex",
  "lane_scores": {
    "activation_routing": 10,
    "production_usability": 25,
    "task_completeness": 35,
    "evidence_discipline": 20,
    "language_scope": 10
  },
  "total": 100,
  "verdict": "PASS",
  "critical_failures": [],
  "activation_verified": true,
  "evidence": [
    "final.md:1-15 selects Variant A and applies story/continuity hard gates before camera aesthetics; B fails its open-case, left-hand and green-door endpoint violations.",
    "final.md:17-33 explicitly says there were no independent clip/frame observations, classifies the supplied facts as user-reported observations, and keeps flicker/drift/crop causes as hypotheses.",
    "final.md:35-46 routes A to a four-frame local reflection repair, fixes all contract invariants, treats slower push-in as a separate optional local change, and imposes a one-pass-plus-one-camera-pass stop.",
    "final.md:48-57 identifies the exact dense-frame, endpoint, delivery and runtime evidence still required for final approval or deeper causal diagnosis.",
    "events.jsonl:3-8 records automatic routing to video QC, the read of .agents/skills/seedance-video-qc/SKILL.md and the variant-comparison reference; request.json records implicit mode with the unchanged prompt.",
    "run.json:9-21 records exit_code 0, final_present true, research absent and no paid media events; workspace-inventory.json records no research or grader in the isolated workspace."
  ],
  "rationale": "The correct variant wins for the correct reason: identity/state/direction/end hard gates precede beauty. The response does not invent direct inspection, identifies A's slower push and flicker as bounded local candidates, rejects B's continuity blockers, and states precisely what full-media evidence remains missing. The repair and stop policy is production-usable and finite. No critical trap is present.",
  "activation_evidence": "Verified implicit activation: events.jsonl:3-8 shows Codex announcing and reading the project-local seedance-video-qc skill plus its variant rubric before answering; request.json confirms implicit invocation.",
  "unknowns": [
    "No actual clips or frames were provided, so the reported hard-gate states and defects were not independently visualized.",
    "Native dimensions/frame rates, dense flicker frames, camera-speed tolerance and platform/model provenance remain unknown until final approval evidence arrives."
  ],
  "grader": {
    "role": "Independent Staff+ Adversarial Evaluator",
    "model": "gpt-5.6-sol",
    "effort": "ultra",
    "independent": true
  }
}
