{"case_id":"ambiguous-extension-boundary","host":"claude-code","lane_scores":{"activation_routing":10,"production_usability":23,"task_completeness":35,"evidence_discipline":19,"language_scope":7},"total":94,"verdict":"PASS","critical_failures":[],"activation_verified":true,"evidence":["run.json: seedance-prompt-director is the sole activated skill; paid_media_tool_events is empty.","final.md identifies that 「向前續寫」 does not establish prepend versus append and explicitly refuses to draft against an unconfirmed boundary.","final.md ends with one actionable either/or question asking whether the five seconds go after the ending or before the opening.","final.md contains no provisional extension prompt and invents no source-video content."],"rationale":"The answer correctly stops on the only material ambiguity and asks the required boundary question. It is substantially more verbose and more bilingual than the requested compact interaction, which costs scope-fidelity points but does not defeat the correct gate.","activation_evidence":"native-evidence.md records explicit seedance-prompt-director activation at event[17] Read and event[29] Read.","unknowns":["Whether the requested interval is append or prepend remains intentionally unresolved pending the user's answer."],"grader":{"role":"fresh-context adversarial reviewer","model":"gpt-5.6-sol","effort":"high","independent":true}}
