{
  "case_id": "fight-physics-contact",
  "host": "codex",
  "lane_scores": {
    "activation_routing": 10,
    "production_usability": 25,
    "task_completeness": 35,
    "evidence_discipline": 20,
    "language_scope": 10
  },
  "total": 100,
  "verdict": "PASS",
  "critical_failures": [],
  "activation_verified": true,
  "evidence": [
    "final.md:3-11 labels runtime unknown, identifies overload, and removes 360/push/overhead competition in favor of one small arc.",
    "final.md:15-52 preserves both fighters, wrist grab, hip escape, shoulder contact, exactly two slides, final face-off, and contact/force/inertia/friction/heavy-clothing physics.",
    "final.md:55-83 supplies observable checks and bounded locked-camera, diagram/keyframe, post-freeze, or split routes without guarantees.",
    "native-evidence.md:11-12 verifies Prompt Director; run.json records no paid generation."
  ],
  "rationale": "The action remains complete while camera overload is simplified, physics is causal, and revisions are bounded and input/post-aware.",
  "activation_evidence": "native-evidence.md:11-12 verifies expected explicit activation.",
  "unknowns": [],
  "grader": {
    "role": "Independent adversarial reviewer (provider: OpenAI)",
    "model": "gpt-5.6-sol",
    "effort": "high",
    "independent": true
  }
}
