{"case_id":"append-extension-boundary","host":"claude-code","lane_scores":{"activation_routing":10,"production_usability":25,"task_completeness":35,"evidence_discipline":19,"language_scope":9},"total":98,"verdict":"PASS","critical_failures":[],"activation_verified":true,"evidence":["run.json: implicit activation is seedance-prompt-director only; paid_media_tool_events is empty.","final.md declares an append after @Video 1 and protects the complete source from modification, replay, or retiming.","final.md reconstructs the last-frame gait, orientation, camera movement, corridor light, and ambience by inheritance rather than inventing their values.","final.md preserves the same person, right-hand door close, fully shut door, released handle, and one-prompt-only delivery."],"rationale":"The prompt is a clean post-source delta with an explicit boundary and complete final ownership/contact state. No wrong-side extension or source rewrite occurs.","activation_evidence":"native-evidence.md records seedance-prompt-director activation at event[7] Skill, event[14] Read, and event[16] Read.","unknowns":["The actual source tail is unavailable, so inherited boundary details cannot be independently verified."],"grader":{"role":"fresh-context adversarial reviewer","model":"gpt-5.6-sol","effort":"high","independent":true}}
