{"case_id":"fight-physics-contact","host":"claude-code","lane_scores":{"activation_routing":10,"production_usability":24,"task_completeness":34,"evidence_discipline":19,"language_scope":9},"total":96,"verdict":"PASS","critical_failures":[],"activation_verified":true,"evidence":["run.json: explicit seedance-prompt-director activation is verified; paid_media_tool_events is empty.","final.md identifies the 360-orbit/push-in/rise/freeze combination as overloaded and reduces it to one slow quarter-arc, moving freeze to post.","final.md preserves A-left-hand to B-right-wrist contact, hip escape, shoulder impact, two short backward slides without falling, and the final face-off.","final.md specifies contact-force-inertia-friction-clothing physics and a bounded single-variable ladder that routes to locked camera, keyframe/blockout, or split shots."],"rationale":"The response prioritizes causal readability, retains every required action/end state, and explicitly refuses to promise success through more prose. The blockout/diagram route is mentioned rather than fully instantiated, a small completeness deduction.","activation_evidence":"native-evidence.md records seedance-prompt-director activation at event[12] Read, event[14] Read, and event[16] Read.","unknowns":["Selected platform/model and the actual feasibility of the eight-second action chain are unknown."],"grader":{"role":"fresh-context adversarial reviewer","model":"gpt-5.6-sol","effort":"high","independent":true}}
